{
  "evidence_id": "EVID-0001",
  "incident_id": "NEPAL-RASUWA-2026",
  "record_ids": ["RR-0001", "RR-0002", "RR-0003"],
  "classification": "FACT",
  "statement": "The family appeal and two official Makwanpur records do not yet contain a hard identifier that conclusively links the family subject to either official candidate.",
  "reliability": "High as a statement about the current evidence set",
  "created_at": "2026-08-29",
  "notes": "Do not convert unresolved identity into a physical outcome inference."
}
